{
  "version": "2.0",
  "geometry": {
    "sites_per_word": 10,
    "words": [
      {
        "positions": {
          "x_start": 1.0,
          "y_start": 2.5,
          "x_spacing": [2.0, 2.0, 2.0, 2.0],
          "y_spacing": [2.5]
        },
        "site_indices": [
          [0, 0],
          [1, 0],
          [2, 0],
          [3, 0],
          [4, 0],
          [0, 1],
          [1, 1],
          [2, 1],
          [3, 1],
          [4, 1]
        ]
      },
      {
        "positions": {
          "x_start": 1.0,
          "y_start": 12.5,
          "x_spacing": [2.0, 2.0, 2.0, 2.0],
          "y_spacing": [2.5]
        },
        "site_indices": [
          [0, 0],
          [1, 0],
          [2, 0],
          [3, 0],
          [4, 0],
          [0, 1],
          [1, 1],
          [2, 1],
          [3, 1],
          [4, 1]
        ]
      }
    ]
  },
  "buses": {
    "site_buses": [
      { "src": [0, 1, 2, 3, 4], "dst": [5, 6, 7, 8, 9] },
      { "src": [0, 1, 2, 3], "dst": [6, 7, 8, 9] },
      { "src": [0, 1, 2], "dst": [7, 8, 9] },
      { "src": [0, 1], "dst": [8, 9] },
      { "src": [0], "dst": [9] },
      { "src": [4], "dst": [5] },
      { "src": [3, 4], "dst": [5, 6] },
      { "src": [2, 3, 4], "dst": [5, 6, 7] },
      { "src": [1, 2, 3, 4], "dst": [5, 6, 7, 8] }
    ],
    "word_buses": [{ "src": [0], "dst": [1] }]
  },
  "words_with_site_buses": [0, 1],
  "sites_with_word_buses": [5, 6, 7, 8, 9],
  "zones": [{ "words": [0, 1] }],
  "entangling_zones": [[[0, 1]]],
  "blockade_radius": 2.0,
  "measurement_mode_zones": [0]
}
